{
  "schema_version": "1.0.0",
  "artifact": "requirements",
  "run_id": "RUN-20260601-163420",
  "generated_at": "2026-06-01T16:34:20+08:00",
  "producer": {
    "agent": "Requirement Evidence Agent",
    "version": "1.0.0"
  },
  "source_mode": "markdown_only",
  "source_documents": [
    {
      "document_id": "SRC001",
      "path": "input/高压线路无人机巡检方案技术要求.md",
      "kind": "technical_requirements_markdown",
      "sha256": "f469eb7d0341b45586aab4ca2a49e0916f2d7154afe87af44361eeef27eb5a2a"
    },
    {
      "document_id": "SRC002",
      "path": "input/方案撰写要求.md",
      "kind": "writing_requirements_markdown",
      "sha256": "9247884d480b532d9bf89193e024868c2776f278c19abe673c5cd6fdfcc48df5"
    }
  ],
  "inputs": [
    {
      "input_id": "IN001",
      "path": "input/高压线路无人机巡检方案技术要求.md",
      "kind": "technical_requirements",
      "sha256": "f469eb7d0341b45586aab4ca2a49e0916f2d7154afe87af44361eeef27eb5a2a"
    },
    {
      "input_id": "IN002",
      "path": "input/方案撰写要求.md",
      "kind": "writing_requirements",
      "sha256": "9247884d480b532d9bf89193e024868c2776f278c19abe673c5cd6fdfcc48df5"
    },
    {
      "input_id": "IN003",
      "path": "templates/投标方案模板.docx",
      "kind": "template",
      "sha256": "fbacc3e73c12bad38c47881856261340b6c3e506fe693d06907ba7fb9135e6d2"
    },
    {
      "input_id": "IN004",
      "path": "templates/生成规则.md",
      "kind": "rules",
      "sha256": "e3b0c44298fc1c149afbf4c8996fb92427ae41e4649b934ca495991b7852b855"
    }
  ],
  "project": {
    "name": "1. 多源异构数据接入与解析引擎",
    "tender_name": "1. 多源异构数据接入与解析引擎",
    "bidder_name_status": "missing"
  },
  "requirements": [
    {
      "requirement_id": "T001",
      "category": "technical_function",
      "title": "多模式数据导入",
      "text": "多模式数据导入：系统须支持通过离线物理介质批量导入、对象存储挂载以及标准API接口推送等方式，接入可见光图像、红外热像图、视频流及激光雷达（LiDAR）点云数据。",
      "source": {
        "source_file": "input/高压线路无人机巡检方案技术要求.md",
        "locator": "1. 多源异构数据接入与解析引擎/L2",
        "quote": "多模式数据导入：系统须支持通过离线物理介质批量导入、对象存储挂载以及标准API接口推送等方式，接入可见光图像、红外热像图、视频流及激光雷达（LiDAR）点云数据。",
        "normalized_text": "多模式数据导入：系统须支持通过离线物理介质批量导入、对象存储挂载以及标准API接口推送等方式，接入可见光图像、红外热像图、视频流及激光雷达（LiDAR）点云数据。"
      },
      "keywords": [
        "雷达",
        "接口"
      ],
      "mandatory": true,
      "need_diagram": true,
      "status": "extracted",
      "risk_level": "normal",
      "target_sections": [
        "功能设计",
        "接口设计"
      ],
      "warnings": []
    },
    {
      "requirement_id": "Q001",
      "category": "technical_quality",
      "title": "元数据提取与标准化",
      "text": "元数据提取与标准化：自动提取影像文件中的EXIF信息及飞行平台遥测数据（包含经纬度、高程、偏航角、俯仰角、拍摄时间等），并进行统一的数据格式清洗与入库。",
      "source": {
        "source_file": "input/高压线路无人机巡检方案技术要求.md",
        "locator": "1. 多源异构数据接入与解析引擎/L3",
        "quote": "元数据提取与标准化：自动提取影像文件中的EXIF信息及飞行平台遥测数据（包含经纬度、高程、偏航角、俯仰角、拍摄时间等），并进行统一的数据格式清洗与入库。",
        "normalized_text": "元数据提取与标准化：自动提取影像文件中的EXIF信息及飞行平台遥测数据（包含经纬度、高程、偏航角、俯仰角、拍摄时间等），并进行统一的数据格式清洗与入库。"
      },
      "keywords": [
        "1.",
        "多源异构数据接入与解析引擎",
        "元数据提取与标准化",
        "自动提取影像文件中的"
      ],
      "mandatory": false,
      "need_diagram": false,
      "status": "extracted",
      "risk_level": "normal",
      "target_sections": [
        "质量与安全设计"
      ],
      "warnings": []
    },
    {
      "requirement_id": "Q002",
      "category": "technical_quality",
      "title": "空间坐标匹配",
      "text": "空间坐标匹配：建立基于GIS空间运算的匹配规则，利用影像元数据中的GPS坐标与无人机位姿信息，结合电网GIS系统中的杆塔坐标，自动判别影像所属的线路段与具体杆塔。",
      "source": {
        "source_file": "input/高压线路无人机巡检方案技术要求.md",
        "locator": "2. 输电资产台账与空间位置映射/L7",
        "quote": "空间坐标匹配：建立基于GIS空间运算的匹配规则，利用影像元数据中的GPS坐标与无人机位姿信息，结合电网GIS系统中的杆塔坐标，自动判别影像所属的线路段与具体杆塔。",
        "normalized_text": "空间坐标匹配：建立基于GIS空间运算的匹配规则，利用影像元数据中的GPS坐标与无人机位姿信息，结合电网GIS系统中的杆塔坐标，自动判别影像所属的线路段与具体杆塔。"
      },
      "keywords": [
        "2.",
        "输电资产台账与空间位置映射",
        "空间坐标匹配",
        "建立基于"
      ],
      "mandatory": false,
      "need_diagram": false,
      "status": "extracted",
      "risk_level": "normal",
      "target_sections": [
        "质量与安全设计"
      ],
      "warnings": []
    },
    {
      "requirement_id": "Q003",
      "category": "technical_quality",
      "title": "部件级数据挂载",
      "text": "部件级数据挂载：通过空间解算或图像特征匹配，将采集影像精准归档至杆塔的具体部件（如绝缘子串、防震锤、线夹等）逻辑节点之下。",
      "source": {
        "source_file": "input/高压线路无人机巡检方案技术要求.md",
        "locator": "2. 输电资产台账与空间位置映射/L8",
        "quote": "部件级数据挂载：通过空间解算或图像特征匹配，将采集影像精准归档至杆塔的具体部件（如绝缘子串、防震锤、线夹等）逻辑节点之下。",
        "normalized_text": "部件级数据挂载：通过空间解算或图像特征匹配，将采集影像精准归档至杆塔的具体部件（如绝缘子串、防震锤、线夹等）逻辑节点之下。"
      },
      "keywords": [
        "2.",
        "输电资产台账与空间位置映射",
        "部件级数据挂载",
        "通过空间解算或图像特征匹配"
      ],
      "mandatory": false,
      "need_diagram": false,
      "status": "extracted",
      "risk_level": "normal",
      "target_sections": [
        "质量与安全设计"
      ],
      "warnings": []
    },
    {
      "requirement_id": "Q004",
      "category": "technical_quality",
      "title": "可见光缺陷识别",
      "text": "可见光缺陷识别： 内置深度学习模型，对断股、绝缘子破损、开口销脱落、金具锈蚀、鸟巢及外力破坏等典型隐患进行自动识别与框选标注。",
      "source": {
        "source_file": "input/高压线路无人机巡检方案技术要求.md",
        "locator": "3. 人工智能视觉分析中台/L12",
        "quote": "可见光缺陷识别： 内置深度学习模型，对断股、绝缘子破损、开口销脱落、金具锈蚀、鸟巢及外力破坏等典型隐患进行自动识别与框选标注。",
        "normalized_text": "可见光缺陷识别： 内置深度学习模型，对断股、绝缘子破损、开口销脱落、金具锈蚀、鸟巢及外力破坏等典型隐患进行自动识别与框选标注。"
      },
      "keywords": [
        "3.",
        "人工智能视觉分析中台",
        "可见光缺陷识别",
        "内置深度学习模型"
      ],
      "mandatory": false,
      "need_diagram": false,
      "status": "extracted",
      "risk_level": "normal",
      "target_sections": [
        "质量与安全设计"
      ],
      "warnings": []
    },
    {
      "requirement_id": "Q005",
      "category": "technical_quality",
      "title": "红外热点分析",
      "text": "红外热点分析： 自动解析红外图像的温度矩阵，对比同类设备温差及历史温度趋势，识别线夹及金具的异常发热缺陷。",
      "source": {
        "source_file": "input/高压线路无人机巡检方案技术要求.md",
        "locator": "3. 人工智能视觉分析中台/L13",
        "quote": "红外热点分析： 自动解析红外图像的温度矩阵，对比同类设备温差及历史温度趋势，识别线夹及金具的异常发热缺陷。",
        "normalized_text": "红外热点分析： 自动解析红外图像的温度矩阵，对比同类设备温差及历史温度趋势，识别线夹及金具的异常发热缺陷。"
      },
      "keywords": [
        "3.",
        "人工智能视觉分析中台",
        "红外热点分析",
        "自动解析红外图像的温度矩阵"
      ],
      "mandatory": false,
      "need_diagram": false,
      "status": "extracted",
      "risk_level": "normal",
      "target_sections": [
        "质量与安全设计"
      ],
      "warnings": []
    },
    {
      "requirement_id": "T002",
      "category": "technical_function",
      "title": "模型训练与管理",
      "text": "模型训练与管理： 具备算法模型版本管理功能，支持将人工复核修正后的样本数据自动回流至训练集，支撑算法的持续迭代与泛化能力提升。",
      "source": {
        "source_file": "input/高压线路无人机巡检方案技术要求.md",
        "locator": "3. 人工智能视觉分析中台/L14",
        "quote": "模型训练与管理： 具备算法模型版本管理功能，支持将人工复核修正后的样本数据自动回流至训练集，支撑算法的持续迭代与泛化能力提升。",
        "normalized_text": "模型训练与管理： 具备算法模型版本管理功能，支持将人工复核修正后的样本数据自动回流至训练集，支撑算法的持续迭代与泛化能力提升。"
      },
      "keywords": [
        "3.",
        "人工智能视觉分析中台",
        "模型训练与管理",
        "具备算法模型版本管理功能"
      ],
      "mandatory": false,
      "need_diagram": true,
      "status": "extracted",
      "risk_level": "normal",
      "target_sections": [
        "功能设计"
      ],
      "warnings": []
    },
    {
      "requirement_id": "T003",
      "category": "technical_function",
      "title": "通道三维重建",
      "text": "通道三维重建： 支持海量LiDAR点云数据的轻量化渲染与三维可视化展示。",
      "source": {
        "source_file": "input/高压线路无人机巡检方案技术要求.md",
        "locator": "4. 三维点云数据处理与分析/L18",
        "quote": "通道三维重建： 支持海量LiDAR点云数据的轻量化渲染与三维可视化展示。",
        "normalized_text": "通道三维重建： 支持海量LiDAR点云数据的轻量化渲染与三维可视化展示。"
      },
      "keywords": [
        "4.",
        "三维点云数据处理与分析",
        "通道三维重建",
        "支持海量"
      ],
      "mandatory": false,
      "need_diagram": true,
      "status": "extracted",
      "risk_level": "normal",
      "target_sections": [
        "功能设计"
      ],
      "warnings": []
    },
    {
      "requirement_id": "T004",
      "category": "technical_function",
      "title": "空间距离测算",
      "text": "空间距离测算： 具备自动提取导线、地面及周边植被模型的算法，自动计算交跨距离及树障安全距离，并在三维空间中标注危险点。",
      "source": {
        "source_file": "input/高压线路无人机巡检方案技术要求.md",
        "locator": "4. 三维点云数据处理与分析/L19",
        "quote": "空间距离测算： 具备自动提取导线、地面及周边植被模型的算法，自动计算交跨距离及树障安全距离，并在三维空间中标注危险点。",
        "normalized_text": "空间距离测算： 具备自动提取导线、地面及周边植被模型的算法，自动计算交跨距离及树障安全距离，并在三维空间中标注危险点。"
      },
      "keywords": [
        "安全"
      ],
      "mandatory": false,
      "need_diagram": true,
      "status": "extracted",
      "risk_level": "normal",
      "target_sections": [
        "功能设计",
        "安全设计"
      ],
      "warnings": []
    },
    {
      "requirement_id": "Q006",
      "category": "technical_quality",
      "title": "人机协同复核",
      "text": "人机协同复核： 提供高效的阅片交互界面，辅助人工对AI初筛生成的缺陷记录进行快速审核、修正与评级。",
      "source": {
        "source_file": "input/高压线路无人机巡检方案技术要求.md",
        "locator": "5. 缺陷管理与业务协同/L23",
        "quote": "人机协同复核： 提供高效的阅片交互界面，辅助人工对AI初筛生成的缺陷记录进行快速审核、修正与评级。",
        "normalized_text": "人机协同复核： 提供高效的阅片交互界面，辅助人工对AI初筛生成的缺陷记录进行快速审核、修正与评级。"
      },
      "keywords": [
        "5.",
        "缺陷管理与业务协同",
        "人机协同复核",
        "提供高效的阅片交互界面"
      ],
      "mandatory": false,
      "need_diagram": false,
      "status": "extracted",
      "risk_level": "normal",
      "target_sections": [
        "质量与安全设计"
      ],
      "warnings": []
    },
    {
      "requirement_id": "T005",
      "category": "technical_function",
      "title": "工单流转管控",
      "text": "工单流转管控：根据缺陷等级自动生成消缺建议，并通过接口向电网生产系统触发工单流转。",
      "source": {
        "source_file": "input/高压线路无人机巡检方案技术要求.md",
        "locator": "5. 缺陷管理与业务协同/L24",
        "quote": "工单流转管控：根据缺陷等级自动生成消缺建议，并通过接口向电网生产系统触发工单流转。",
        "normalized_text": "工单流转管控：根据缺陷等级自动生成消缺建议，并通过接口向电网生产系统触发工单流转。"
      },
      "keywords": [
        "接口"
      ],
      "mandatory": false,
      "need_diagram": true,
      "status": "extracted",
      "risk_level": "normal",
      "target_sections": [
        "功能设计",
        "接口设计"
      ],
      "warnings": []